{
  "$schema": "https://json-schema.org/draft/2020-12/schema",
  "title": "VectorCompletionsResponseStreamingVectorCompletionChunk",
  "description": "A chunk in a streaming vector completion response.\n\nEach chunk contains incremental updates to the completion. Use the\n[`push`](Self::push) method to accumulate chunks into a complete response.",
  "type": "object",
  "properties": {
    "id": {
      "description": "Unique identifier for this vector completion.",
      "type": "string"
    },
    "completions": {
      "description": "Incremental agent completion chunks from each agent.",
      "type": "array",
      "items": {
        "$ref": "VectorCompletionsResponseStreamingAgentCompletionChunk"
      }
    },
    "votes": {
      "description": "Votes received so far. New votes are appended in subsequent chunks.",
      "type": "array",
      "items": {
        "$ref": "VectorCompletionsResponseVote"
      }
    },
    "scores": {
      "description": "Current weighted scores. Updated as new votes arrive.",
      "type": "array",
      "items": {
        "type": [
          "string",
          "number"
        ],
        "pattern": "^-?\\d+(\\.\\d+)?([eE]\\d+)?$"
      }
    },
    "weights": {
      "description": "Current weight distribution across responses. Updated as new votes arrive.",
      "type": "array",
      "items": {
        "type": [
          "string",
          "number"
        ],
        "pattern": "^-?\\d+(\\.\\d+)?([eE]\\d+)?$"
      }
    },
    "created": {
      "description": "Unix timestamp when the completion was created.",
      "type": "integer",
      "format": "uint64",
      "minimum": 0
    },
    "ensemble": {
      "description": "ID of the ensemble used for this completion.",
      "type": "string"
    },
    "object": {
      "description": "Object type identifier (`\"vector.completion.chunk\"`).",
      "$ref": "VectorCompletionsResponseStreamingObject"
    },
    "usage": {
      "description": "Aggregated usage statistics. Typically present only in the final chunk.",
      "anyOf": [
        {
          "$ref": "AgentCompletionsResponseUsage"
        },
        {
          "type": "null"
        }
      ]
    }
  },
  "required": [
    "id",
    "completions",
    "votes",
    "scores",
    "weights",
    "created",
    "ensemble",
    "object"
  ]
}
