{
  "id": "",
  "completions": [
    {
      "index": 0,
      "id": "",
      "created": 0,
      "messages": [
        {
          "role": "assistant",
          "index": 0,
          "created": 0,
          "agent": "425mMcWqssOpPRrsDrjB0B",
          "model": "mock",
          "upstream_id": "",
          "reasoning": "pHIe5X06XFqnQ8N4IXaYk1LYNhbZefkxgkMVGeB2j5lFcBnskXfp4SabPNkD86gYcEu6gJI85D9kSPq7s93mFIxhKEDzjYEZFkQfCtyqDH7DVIexYDkvFIY0cTLtIMaL1TwIONnJJIYQwZ7glNs2Do3QeUKL7 7QEOYTou5caSDuMUg6cewOJRpiuVgQhLKCdEdQJn5Z61sHPcRlzH1pRpBrT0h3u2vBBIsLIxfCc8PCCUPS5z95gQwy",
          "tool_calls": null,
          "content": "f3DnhrFIzcPJEWxkL43rEz238C2Mf7OYeiFKnUvbq B2zpWHi66ETVO0i7e1uIOAih",
          "refusal": null,
          "finish_reason": "stop",
          "logprobs": null,
          "usage": {
            "completion_tokens": 0,
            "prompt_tokens": 0,
            "total_tokens": 0,
            "cost": 0.0,
            "total_cost": 0.0,
            "cost_multiplier": 0.0,
            "is_byok": false
          }
        }
      ],
      "object": "agent.completion",
      "usage": {
        "completion_tokens": 0,
        "prompt_tokens": 0,
        "total_tokens": 0,
        "cost": 0.0,
        "total_cost": 0.0
      },
      "upstream": "mock",
      "error": null
    },
    {
      "index": 1,
      "id": "",
      "created": 0,
      "messages": [
        {
          "role": "assistant",
          "index": 0,
          "created": 0,
          "agent": "425mMcWqssOpPRrsDrjB0B",
          "model": "mock",
          "upstream_id": "",
          "reasoning": "PMKeeeu1iMURazs6UTwAOlyapDz3TBN6tyNyOMSiuJoJPgD dd4ad4ISiHFGSjgAqeMqySj0xRcApShkWLC 5iBLogTNFD6Bd0dpg8UAfzxgh48cPO2kyoZ2P05N8nsyMkOevLBoDyHDSAOxxCaoFC9HZ02brnMVtHpa3ylWgYxmZL9 BWNB7AhUXwS9pWGmplRjHm1ERHlFiDnFtMn K VkzExf4tHrZfOlg1QP6PyZVzrfe6Vb94btdJ83Pdt5LbfemxeR1mGf H9hbTd8YKqELSE IhpqFkTyNyAxgH3iy4v8D0h535HHbQh2VZN0eYX7PmyP0lV2 Z2tbMhgaAKuov3ltkrSKRWrEQEhjDMFaaFI3X zaj7kShbjsq",
          "tool_calls": null,
          "content": "zfz4rY1lp u0TGp4HSxQBjuiIQDhS JoDyWEgVi3CQMLmwjZQDKDtMN cI6GameCIyWFl7zXEcxkYzGnB95oqr",
          "refusal": null,
          "finish_reason": "stop",
          "logprobs": null,
          "usage": {
            "completion_tokens": 0,
            "prompt_tokens": 0,
            "total_tokens": 0,
            "cost": 0.0,
            "total_cost": 0.0,
            "cost_multiplier": 0.0,
            "is_byok": false
          }
        }
      ],
      "object": "agent.completion",
      "usage": {
        "completion_tokens": 0,
        "prompt_tokens": 0,
        "total_tokens": 0,
        "cost": 0.0,
        "total_cost": 0.0
      },
      "upstream": "mock",
      "error": null
    },
    {
      "index": 2,
      "id": "",
      "created": 0,
      "messages": [
        {
          "role": "assistant",
          "index": 1,
          "created": 0,
          "agent": "425mMcWqssOpPRrsDrjB0B",
          "model": "mock",
          "upstream_id": "",
          "reasoning": "G hXXko24vIMixTWEDcYm4dw0wTZ5MaIZ SYScq1ecuR8uvYJPKkMTcqLa5kCOHKn2h B20nKlqDBDSf3E73 Xx7BvEFqNj5I w BoQlcls7aDqfmZ7 tZGQ14thn4dwdS0NtHroauh1FPOlhwTtVWfa6O4CM71MFX1pvV A4kHugTOWbbQRywmmta7Pk7pm6kesuJ0qFyRjFAn3IWbcxOVZu8xs6198OdvgV1uU",
          "tool_calls": null,
          "content": "j3IlAybxDNwn7iPY7eq8rsYqIP1",
          "refusal": null,
          "finish_reason": "stop",
          "logprobs": null,
          "usage": {
            "completion_tokens": 0,
            "prompt_tokens": 0,
            "total_tokens": 0,
            "cost": 0.0,
            "total_cost": 0.0,
            "cost_multiplier": 0.0,
            "is_byok": false
          }
        }
      ],
      "object": "agent.completion",
      "usage": {
        "completion_tokens": 0,
        "prompt_tokens": 0,
        "total_tokens": 0,
        "cost": 0.0,
        "total_cost": 0.0
      },
      "upstream": "mock",
      "error": null
    },
    {
      "index": 3,
      "id": "",
      "created": 0,
      "messages": [
        {
          "role": "assistant",
          "index": 1,
          "created": 0,
          "agent": "425mMcWqssOpPRrsDrjB0B",
          "model": "mock",
          "upstream_id": "",
          "reasoning": "7x1xRvVrYbwsISUO7YkEpckqccBtt7As3URGsoD1uR1XmQH9RYHR8h1PszoRPSgLbcMgPv8ji19aL4efywiI5414J PKJw0LsKb0aycKcWQ fnqi3mLXVecHBfse3YntpP55ii3iZzRnpYy4IFGTrHl73pyKrYTEWPKGDzlqJOd1T8Kedxj5ud6291216w4Tvdeg2jHZcPx0THtvLgxT0zE8K31h3rqHY2EeRzNSxwpn0d5AqS dZNmA MdOXveHP0oDwQF5 SkCJjlnoVSZSYL9vu6YIj3nKvPLnLdJK83J8 tzGsSrqy7dw4gx cyzJDH1i6ujikQ2x9WwB1yAIdqFpm5E8A2SHn3PcrlvvcMSnEy7NBf95izgBRAL7MfaQCZuUqmbFtJ0Je2wSfvQ1ahuk CsnHujADLMFurergbSpcxBBVOFmYyjdcfPXwC6sJiPpUp3A YWapXNg XHj1YuIuapuoLCfgfAFC1ZCQNYv",
          "tool_calls": null,
          "content": "3NQcDIlR3gSFdOp3B7Bofkch6ITP3EW1fJX0oLPNFsd52YTluTLa0aQx",
          "refusal": null,
          "finish_reason": "stop",
          "logprobs": null,
          "usage": {
            "completion_tokens": 0,
            "prompt_tokens": 0,
            "total_tokens": 0,
            "cost": 0.0,
            "total_cost": 0.0,
            "cost_multiplier": 0.0,
            "is_byok": false
          }
        }
      ],
      "object": "agent.completion",
      "usage": {
        "completion_tokens": 0,
        "prompt_tokens": 0,
        "total_tokens": 0,
        "cost": 0.0,
        "total_cost": 0.0
      },
      "upstream": "mock",
      "error": null
    }
  ],
  "votes": [],
  "scores": [
    0.5,
    0.5
  ],
  "weights": [
    0.0,
    0.0
  ],
  "created": 0,
  "ensemble": "0Ngq9JcJ5LoAhDDoowvkF6",
  "object": "vector.completion",
  "usage": {
    "completion_tokens": 0,
    "prompt_tokens": 0,
    "total_tokens": 0,
    "cost": 0.0,
    "total_cost": 0.0
  }
}