{
  "id": "",
  "completions": [
    {
      "index": 0,
      "id": "",
      "created": 0,
      "messages": [
        {
          "role": "assistant",
          "index": 0,
          "created": 0,
          "agent": "425mMcWqssOpPRrsDrjB0B",
          "model": "mock",
          "upstream_id": "",
          "tool_calls": null,
          "content": "pI2O z9cMAvUl1NiEaZ6LF2ySiYGZnOakGDdPOq1DF9FAdfwtCiYKmGzk",
          "refusal": null,
          "finish_reason": "stop",
          "logprobs": null
        }
      ],
      "object": "agent.completion",
      "usage": {
        "completion_tokens": 0,
        "prompt_tokens": 0,
        "total_tokens": 0,
        "cost": 0.0,
        "total_cost": 0.0,
        "cost_multiplier": 0.0,
        "is_byok": false
      },
      "upstream": "mock",
      "error": null
    },
    {
      "index": 1,
      "id": "",
      "created": 0,
      "messages": [
        {
          "role": "assistant",
          "index": 1,
          "created": 0,
          "agent": "425mMcWqssOpPRrsDrjB0B",
          "model": "mock",
          "upstream_id": "",
          "reasoning": "FAayoxJf1 qjObQDpDJbQtmF2ZD0jlgs597a1u5vZ1Va4 rqPGYpLYpntA7TbdKJdyxZSyKjlghvgGWu9YXhi68FbyLJ4eksCDfkpVmnfwtoai7M1LUxqfNxN8jvDW8MCW2OUxze8UubaD5v1OPLBOL3pSUrESFxICods7OcTA7wt01H38hZf eMtxdgrf9Kc4pbEjI8O8tzFp28afrt1RvjnJCYz7DJgjMDBrWZET6l3a2qfLJlyvytHlRq9wXABXRNTLmxKN3fDGiX3eHaruQJsiORwrM3U3Qui4gOZt9ON51xSpmGBkT96tBypk7JDHUrLsQ3ymsBoUBHNi0Jbylr9aRIJ5dojgox2ERSdIV4whx6WHDuCR6CwalMsZ3HJbOL0zxH DVgghrXq5HBxNpBt1bsrDKBRis5ooP036R5bOUOot0FZBb7lSnIkJ3t5h4WJlhxe7UOFYWzwvawabVfgzAMYxVfwiPoMLno5bEVWxykSZrFEB",
          "tool_calls": null,
          "content": "qqJOgxl79oWcaRfMZhHK0HCjlt11z98iqNO XzctNagUxxgD43S5KrwQBYSxAfWTo0NcL",
          "refusal": null,
          "finish_reason": "stop",
          "logprobs": null
        }
      ],
      "object": "agent.completion",
      "usage": {
        "completion_tokens": 0,
        "prompt_tokens": 0,
        "total_tokens": 0,
        "cost": 0.0,
        "total_cost": 0.0,
        "cost_multiplier": 0.0,
        "is_byok": false
      },
      "upstream": "mock",
      "error": null
    }
  ],
  "votes": [],
  "scores": [
    0.04,
    0.04,
    0.04,
    0.04,
    0.04,
    0.04,
    0.04,
    0.04,
    0.04,
    0.04,
    0.04,
    0.04,
    0.04,
    0.04,
    0.04,
    0.04,
    0.04,
    0.04,
    0.04,
    0.04,
    0.04,
    0.04,
    0.04,
    0.04,
    0.04
  ],
  "weights": [
    0.0,
    0.0,
    0.0,
    0.0,
    0.0,
    0.0,
    0.0,
    0.0,
    0.0,
    0.0,
    0.0,
    0.0,
    0.0,
    0.0,
    0.0,
    0.0,
    0.0,
    0.0,
    0.0,
    0.0,
    0.0,
    0.0,
    0.0,
    0.0,
    0.0
  ],
  "created": 0,
  "ensemble": "3IIMLyE17jvB2l1RMkS3G8",
  "object": "vector.completion",
  "usage": {
    "completion_tokens": 0,
    "prompt_tokens": 0,
    "total_tokens": 0,
    "cost": 0.0,
    "total_cost": 0.0
  }
}