{
  "id": "",
  "completions": [
    {
      "index": 0,
      "id": "",
      "created": 0,
      "messages": [
        {
          "role": "assistant",
          "index": 0,
          "created": 0,
          "agent": "0Lp0y7y2LyM1VsV2TScyKZ",
          "model": "mock",
          "upstream_id": "",
          "reasoning": "JVX2OmmBL0y9H5wVJ4xi631yp7K6RYpMSXu5wC1lVUhuN8PevY4wyk7LgCzWL9XsDWW5F",
          "tool_calls": null,
          "content": "{\"response_key\":\"`M`\"}",
          "refusal": null,
          "finish_reason": "stop",
          "logprobs": null
        }
      ],
      "object": "agent.completion",
      "usage": {
        "completion_tokens": 0,
        "prompt_tokens": 0,
        "total_tokens": 0,
        "cost": 0.0,
        "total_cost": 0.0,
        "cost_multiplier": 0.0,
        "is_byok": false
      },
      "upstream": "mock",
      "error": null
    },
    {
      "index": 1,
      "id": "",
      "created": 0,
      "messages": [
        {
          "role": "assistant",
          "index": 0,
          "created": 0,
          "agent": "425mMcWqssOpPRrsDrjB0B",
          "model": "mock",
          "upstream_id": "",
          "reasoning": "JVX2OmmBL0y9H5wVJ4xi631yp7K6RYpMSXu5wC1lVUhuN8PevY4wyk7LgCzWL9XsDWW5F",
          "tool_calls": null,
          "content": " zYGnXCkufoIAa4B9 dNZhR7Hv0RPzOCw3sHMIZl8LqgVzYY4BKCXs2FOLln",
          "refusal": null,
          "finish_reason": "stop",
          "logprobs": null
        }
      ],
      "object": "agent.completion",
      "usage": {
        "completion_tokens": 0,
        "prompt_tokens": 0,
        "total_tokens": 0,
        "cost": 0.0,
        "total_cost": 0.0,
        "cost_multiplier": 0.0,
        "is_byok": false
      },
      "upstream": "mock",
      "error": null
    },
    {
      "index": 2,
      "id": "",
      "created": 0,
      "messages": [
        {
          "role": "assistant",
          "index": 0,
          "created": 0,
          "agent": "4wXv5UufT9xfKYKsCLpBXT",
          "model": "mock",
          "upstream_id": "",
          "reasoning": "JVX2OmmBL0y9H5wVJ4xi631yp7K6RYpMSXu5wC1lVUhuN8PevY4wyk7LgCzWL9XsDWW5F",
          "tool_calls": null,
          "content": "{\"response_key\":\"`E`\"}",
          "refusal": null,
          "finish_reason": "stop",
          "logprobs": null
        }
      ],
      "object": "agent.completion",
      "usage": {
        "completion_tokens": 0,
        "prompt_tokens": 0,
        "total_tokens": 0,
        "cost": 0.0,
        "total_cost": 0.0,
        "cost_multiplier": 0.0,
        "is_byok": false
      },
      "upstream": "mock",
      "error": null
    },
    {
      "index": 3,
      "id": "",
      "created": 0,
      "messages": [
        {
          "role": "assistant",
          "index": 1,
          "created": 0,
          "agent": "425mMcWqssOpPRrsDrjB0B",
          "model": "mock",
          "upstream_id": "",
          "reasoning": "QL87K 2ihJJOLtLj8D9f VCeQXjmsQhP6prgWX4x8sVkaDWhVCGirDrVYMQgltZOWudAPs3I3enziohCg6kvOMkpgdMELjXM20bsVqRbXp9lRs2cMCzhZbI GNselmFpHFoKMwXCNIjiSLRsH4hF JQKs 2KgcQycjWoS hu3wdxUxDbuvNUZfTgdTtFGYKVRhOmsfAGXiDHqU0VNsIjchlQlouWF0wgzUs6nksiLOmhNLKWhs",
          "tool_calls": null,
          "content": "CSlNw2UVv502OMYh84tiZS4xujSdNwju7M85iRjtU",
          "refusal": null,
          "finish_reason": "stop",
          "logprobs": null
        }
      ],
      "object": "agent.completion",
      "usage": {
        "completion_tokens": 0,
        "prompt_tokens": 0,
        "total_tokens": 0,
        "cost": 0.0,
        "total_cost": 0.0,
        "cost_multiplier": 0.0,
        "is_byok": false
      },
      "upstream": "mock",
      "error": null
    },
    {
      "index": 4,
      "id": "",
      "created": 0,
      "messages": [
        {
          "role": "assistant",
          "index": 1,
          "created": 0,
          "agent": "0Lp0y7y2LyM1VsV2TScyKZ",
          "model": "mock",
          "upstream_id": "",
          "reasoning": "QL87K 2ihJJOLtLj8D9f VCeQXjmsQhP6prgWX4x8sVkaDWhVCGirDrVYMQgltZOWudAPs3I3enziohCg6kvOMkpgdMELjXM20bsVqRbXp9lRs2cMCzhZbI GNselmFpHFoKMwXCNIjiSLRsH4hF JQKs 2KgcQycjWoS hu3wdxUxDbuvNUZfTgdTtFGYKVRhOmsfAGXiDHqU0VNsIjchlQlouWF0wgzUs6nksiLOmhNLKWhs",
          "tool_calls": [
            {
              "type": "function",
              "id": "call_mock_12966014091075273479",
              "function": {
                "name": "response_key",
                "arguments": "{\"response_key\":\"`G`\"}"
              }
            }
          ],
          "content": null,
          "refusal": null,
          "finish_reason": "tool_calls",
          "logprobs": null
        }
      ],
      "object": "agent.completion",
      "usage": {
        "completion_tokens": 0,
        "prompt_tokens": 0,
        "total_tokens": 0,
        "cost": 0.0,
        "total_cost": 0.0,
        "cost_multiplier": 0.0,
        "is_byok": false
      },
      "upstream": "mock",
      "error": null
    }
  ],
  "votes": [
    {
      "model": "4wXv5UufT9xfKYKsCLpBXT",
      "ensemble_index": 2,
      "flat_ensemble_index": 2,
      "prompt_id": "",
      "tools_id": null,
      "responses_ids": [],
      "vote": [
        0.0,
        0.0,
        0.0,
        1.0
      ],
      "weight": 0.3
    },
    {
      "model": "0Lp0y7y2LyM1VsV2TScyKZ",
      "ensemble_index": 0,
      "flat_ensemble_index": 0,
      "prompt_id": "",
      "tools_id": null,
      "responses_ids": [],
      "vote": [
        0.0,
        1.0,
        0.0,
        0.0
      ],
      "weight": 0.2
    }
  ],
  "scores": [
    0.0,
    0.4,
    0.0,
    0.6
  ],
  "weights": [
    0.0,
    0.2,
    0.0,
    0.3
  ],
  "created": 0,
  "ensemble": "0WogT15T9f4GUQjqGfLGEk",
  "object": "vector.completion",
  "usage": {
    "completion_tokens": 0,
    "prompt_tokens": 0,
    "total_tokens": 0,
    "cost": 0.0,
    "total_cost": 0.0
  }
}