{
  "id": "",
  "completions": [
    {
      "index": 0,
      "id": "",
      "created": 0,
      "messages": [
        {
          "role": "assistant",
          "index": 0,
          "created": 0,
          "agent": "4b6Q8wMySsDjDv3NoTMx8o",
          "model": "mock",
          "upstream_id": "",
          "reasoning": "g E9RbNWmcBynf6tdgu2znKU grg4UAbrD75tUdmwMwDDMpP i2UNVNbV9jNYdLTdUncVSvcfKgcwvMiQdn yHanClLKUXUXWz4VD7hWDOiVrqTdbCcijyM9CMfIWgLgJZDOEVQTCNZ1U0KSb8tR5Gs24qa5BPTgiTeFn15 CDHuIkzPmOV0SuHzcMNdeGovedBlkWlkAHFEXGdGHp98L6BcWNCyS2TDol00tbEJczs OeJfyYxHhmbpYwuQZpzshuPMR1kaDRMbh9wjk2b4rDH6Ut3tYIEDDpTPRSnthy0o BnROcuOyJARNTKQIdxDHNvO8qfqm1ZEfHW oaroSGXdPKcEJqmoQOoKr5qJgAKrb8mm7XKmEWHYlNwhVoeuuCPlI vkIjl6Qo MYxZ 650cd2QWP1e2SU kfjhE gXByCUIyiMOtY3MTMWIJ4nzYmCxOphg RnYBqlmS",
          "tool_calls": [
            {
              "type": "function",
              "id": "call_mock_7426970051677593969",
              "function": {
                "name": "response_key",
                "arguments": "{\"response_key\":\"`M`\"}"
              }
            }
          ],
          "content": null,
          "refusal": null,
          "finish_reason": "tool_calls",
          "logprobs": null
        }
      ],
      "object": "agent.completion",
      "usage": {
        "completion_tokens": 0,
        "prompt_tokens": 0,
        "total_tokens": 0,
        "cost": 0.0,
        "total_cost": 0.0,
        "cost_multiplier": 0.0,
        "is_byok": false
      },
      "upstream": "mock",
      "error": null
    }
  ],
  "votes": [
    {
      "agent": "4b6Q8wMySsDjDv3NoTMx8o",
      "ensemble_index": 0,
      "flat_ensemble_index": 0,
      "prompt_id": "",
      "responses_ids": [],
      "vote": [
        0.0,
        1.0
      ],
      "weight": 1.0
    }
  ],
  "scores": [
    0.0,
    1.0
  ],
  "weights": [
    0.0,
    1.0
  ],
  "created": 0,
  "ensemble": "2K9H3zozjbfEmX8XrBMxij",
  "object": "vector.completion",
  "usage": {
    "completion_tokens": 0,
    "prompt_tokens": 0,
    "total_tokens": 0,
    "cost": 0.0,
    "total_cost": 0.0
  }
}